{
  "schema": "dolly.test-vector/v1",
  "test_id": "TST-FILTER-007",
  "kind": "extension",
  "covers": ["REQ-FILTER-001", "REQ-FILTER-002", "REQ-FILTER-003"],
  "initial": {
    "authority": "host_trusted_manifest_block_bytes_and_exact_asset_reference_grants",
    "prepared_output_role": "archival_byte_evidence_only",
    "forgeries": [
      "action",
      "text",
      "description",
      "asset",
      "block_ref",
      "extra_json",
      "metadata",
      "hint",
      "manifest_block_substitution",
      "asset_authorization",
      "block_ref_authorization",
      "output_budget"
    ],
    "attacker_reseals": ["output_digest", "prepared_output"]
  },
  "stimulus": {
    "command": "reconstruct_complete_activation_payload_from_trusted_selected_block"
  },
  "expected": {
    "outcome": "only_the_exact_v1_projection_is_accepted",
    "assertions": [
      {"path": "/accepted_forgery_count", "op": "equals", "value": 0},
      {"path": "/output/actions", "op": "equals", "value": []},
      {"path": "/output/metadata", "op": "equals", "value": {}},
      {"path": "/output/hints", "op": "equals", "value": {}},
      {"path": "/input/json_parts_copied", "op": "equals", "value": 0}
    ],
    "emitted": [],
    "crash_label": null
  }
}
