{
  "schema": "dolly.test-vector/v1",
  "test_id": "TST-TOOL-002",
  "kind": "service",
  "covers": ["REQ-TOOL-001", "REQ-TOOL-002"],
  "initial": {
    "side_effect_class": "idempotent_write",
    "idempotency_policy": {
      "kind": "argument_key",
      "argument_pointer": "/request_id"
    },
    "operation_id": "0198ab31-6c44-7e8a-b2bb-000000000341",
    "idempotency_key": "stable-request-1",
    "arguments": {
      "request_id": "stable-request-1",
      "value": "example"
    },
    "ledger_state": "DISPATCHED",
    "server_effect_count": 1,
    "authoritative_response_lost": true
  },
  "stimulus": {
    "event": "recover_after_dispatch_without_authoritative_result"
  },
  "expected": {
    "outcome": "argument_key_does_not_authorize_redispatch",
    "assertions": [
      {"path": "/operation_id", "op": "unchanged"},
      {"path": "/automatic_redispatch_count", "op": "equals", "value": 0},
      {"path": "/server_effect_count", "op": "equals", "value": 1},
      {"path": "/ledger_state", "op": "equals", "value": "UNKNOWN"},
      {"path": "/result/status", "op": "equals", "value": "unknown"},
      {"path": "/result/error/code", "op": "equals", "value": "TOOL_EXTERNAL_OUTCOME_UNKNOWN"},
      {"path": "/result/error/retryable", "op": "equals", "value": false}
    ],
    "emitted": [
      {
        "event": "ToolOutcomeUnknown",
        "operation_id": "0198ab31-6c44-7e8a-b2bb-000000000341"
      }
    ],
    "crash_label": "tool_after_dispatch_before_response_persist"
  }
}
