{
  "schema": "dolly.test-vector/v1",
  "test_id": "TST-CORE-017",
  "kind": "core_transition",
  "covers": [
    "INV-ACTIVATION-002",
    "INV-STORAGE-007"
  ],
  "initial": {
    "activation": {
      "state": "ready",
      "attempt": 0
    },
    "generation": 8
  },
  "stimulus": {
    "commands": [
      {
        "command": "IssueLease",
        "command_id": "lease-1",
        "lease_id": "lease-1",
        "activation_id": "a",
        "token_digest": "token",
        "extension_connection_id": "connection-1",
        "worker_epoch": 1,
        "extension_generation": 8
      },
      {
        "command": "IssueLease",
        "command_id": "lease-1-replay",
        "lease_id": "lease-1",
        "activation_id": "a",
        "token_digest": "token",
        "extension_connection_id": "connection-1",
        "worker_epoch": 1
      }
    ]
  },
  "expected": {
    "outcome": "omitted_generation_replay_refused",
    "assertions": [
      {
        "path": "/lease/extension_generation",
        "op": "equals",
        "value": 8
      },
      {
        "path": "/lease/activation_id",
        "op": "equals",
        "value": "a"
      },
      {
        "path": "/lease/state",
        "op": "equals",
        "value": "leased"
      },
      {
        "path": "/activation/state",
        "op": "equals",
        "value": "leased"
      },
      {
        "path": "/activation/attempt",
        "op": "equals",
        "value": 1
      },
      {
        "path": "/replay_error_code",
        "op": "equals",
        "value": "STORAGE_IDEMPOTENCY_CONFLICT"
      }
    ],
    "emitted": [
      {
        "event": "LeaseIssued"
      }
    ],
    "crash_label": null
  }
}