{
  "schema": "dolly.test-vector/v1",
  "test_id": "TST-CORE-003",
  "kind": "core_transition",
  "covers": ["REQ-BLOCK-001", "INV-BLOCK-006", "INV-PAGELOG-004"],
  "initial": {"fixture": "targeted-action-duplicated-on-two-input-pages", "target_module": "web-channel", "other_module": "observer"},
  "stimulus": {"command": "BuildAndRunManifests"},
  "expected": {
    "outcome": "one_target_execution",
    "assertions": [
      {"path": "/target/manifest/input_items", "op": "count", "value": 1},
      {"path": "/target/manifest/input_items/0/occurrence_count", "op": "equals", "value": 2},
      {"path": "/target/action_ledger", "op": "count", "value": 1},
      {"path": "/observer/action_ledger", "op": "count", "value": 0}
    ],
    "emitted": [{
      "schema": "dolly.action-result/v1",
      "action_id": "0198ab31-6c44-7e8a-b2bb-000000000212",
      "status": "succeeded",
      "result": {
        "schema": "dolly.channel.send-result/v1",
        "session_id": "session-main",
        "delivery_outcome": "sent",
        "messages": [{"ordinal": 0, "external_message_id": "transport-1"}]
      },
      "error": null
    }],
    "crash_label": null
  }
}
