{
  "schema": "dolly.test-vector/v1",
  "test_id": "TST-NAPCAT-004",
  "kind": "security",
  "covers": ["REQ-NAPCAT-002", "REQ-NAPCAT-004", "REQ-NAPCAT-006"],
  "initial": {
    "registry_digest": "sha256:1111111111111111111111111111111111111111111111111111111111111111",
    "sanitizer_digest": "sha256:2222222222222222222222222222222222222222222222222222222222222222",
    "registry": [
      {"operation_key": "group-message-history", "upstream_name": "get_group_msg_history"},
      {"operation_key": "send-group-message-async-v2", "upstream_name": "Send.Group_Message_Async.v2/测试"}
    ],
    "output_limits": {
      "max_output_block_bytes": 65536,
      "max_top_level_parts": 8,
      "max_attached_assets": 1,
      "max_attached_asset_bytes": 1048576
    }
  },
  "stimulus": {
    "commands": [
      {
        "command": "invoke_by_key",
        "operation_key": "send-group-message-async-v2",
        "upstream_response": {
          "file": "C:\\Users\\bot\\secret.png",
          "url": "https://user:pass@example.test/a?token=secret#x",
          "cookie": "session=secret",
          "password": "p",
          "authorization": "Bearer x",
          "client_key": "client-secret",
          "media_bytes": 12
        }
      },
      {
        "command": "mailbox_read",
        "upstream_media_segment": {"file": "file:///tmp/a.png", "url": "https://signed.example/a?sig=secret"}
      },
      {"command": "media_acquire", "media_handle": "qq-media-1042-0", "asset_bytes": 12},
      {"command": "media_acquire", "media_handle": "qq-media-too-large", "asset_bytes": 1048577},
      {"command": "build_output", "estimated_canonical_bytes": 65537}
    ]
  },
  "expected": {
    "outcome": "closed_sanitizer_and_hub_owned_media_ingress_with_pre_effect_budget_rejection",
    "assertions": [
      {"path": "/commands/0/dispatched_upstream_name", "op": "equals", "value": "Send.Group_Message_Async.v2/测试"},
      {"path": "/commands/0/result/sanitizer_digest", "op": "equals", "value": "sha256:2222222222222222222222222222222222222222222222222222222222222222"},
      {"path": "/commands/0/result/sanitized_value/file", "op": "absent"},
      {"path": "/commands/0/result/sanitized_value/url", "op": "absent"},
      {"path": "/commands/0/result/sanitized_value/cookie", "op": "absent"},
      {"path": "/commands/0/result/sanitized_value/password", "op": "absent"},
      {"path": "/commands/0/result/sanitized_value/authorization", "op": "absent"},
      {"path": "/commands/0/result/sanitized_value/client_key", "op": "absent"},
      {"path": "/commands/1/event/segments/0/kind", "op": "equals", "value": "media_ref"},
      {"path": "/commands/1/event/segments/0/media_handle", "op": "equals", "value": "qq-media-1042-0"},
      {"path": "/commands/1/event/segments/0/asset_id", "op": "absent"},
      {"path": "/commands/1/event/segments/0/url", "op": "absent"},
      {"path": "/commands/2/result/delivery_ingress_id", "op": "equals", "value": "0198ab31-6c44-7e8a-b2bb-000000000451"},
      {"path": "/commands/2/facade_output_parts/1", "op": "absent"},
      {"path": "/commands/2/hub_media_ingress/parts/0/value/schema", "op": "equals", "value": "dolly.napcatqq-media-delivery/v1"},
      {"path": "/commands/2/hub_media_ingress/parts/1/kind", "op": "equals", "value": "asset"},
      {"path": "/commands/2/hub_media_ingress/producer_module", "op": "equals", "value": "qq-hub-main"},
      {"path": "/commands/2/hub_media_ingress/authoritative_content_hash/algorithm", "op": "equals", "value": "blake3-256"},
      {"path": "/commands/3/error/code", "op": "equals", "value": "NAPCAT_ASSET_BUDGET_EXCEEDED"},
      {"path": "/commands/3/upstream_effect_calls", "op": "count", "value": 0},
      {"path": "/commands/4/error/code", "op": "equals", "value": "NAPCAT_OUTPUT_BUDGET_EXCEEDED"},
      {"path": "/commands/4/upstream_effect_calls", "op": "count", "value": 0}
    ],
    "emitted": [],
    "crash_label": null
  }
}
